{
  "schema": "cognition-pipeline/1",
  "id": "认知:P01",
  "name": "纵深 + 横向 + 知识体系",
  "entry": ["认知:M01", "认知:M11"],
  "exit": ["认知:M03", "认知:M23"],
  "nodes": [
    {"id": "认知:M01", "kind": "method", "cost": 1,
     "inputs": [{"token": "需求画像", "kind": "object"}],
     "outputs": [{"token": "拆解树", "kind": "object"}]},
    {"id": "认知:A01", "kind": "adapter", "cost": 0,
     "inputs": [{"token": "拆解树", "kind": "object"}],
     "outputs": [{"token": "claims", "kind": "array"}]},
    {"id": "认知:M02", "kind": "method", "cost": 2,
     "inputs": [{"token": "claims", "kind": "array"}],
     "outputs": [{"token": "causal_map", "kind": "object"}]},
    {"id": "认知:M03", "kind": "method", "cost": 2,
     "inputs": [{"token": "claims", "kind": "array"},
                {"token": "causal_map", "kind": "object"}],
     "outputs": [{"token": "counterexample_ledger", "kind": "object"}]},
    {"id": "认知:M11", "kind": "method", "cost": 1,
     "inputs": [{"token": "需求画像", "kind": "object"}],
     "outputs": [{"token": "comparison_frame", "kind": "object"}]},
    {"id": "认知:M12", "kind": "method", "cost": 2,
     "inputs": [{"token": "comparison_frame", "kind": "object"}],
     "outputs": [{"token": "comparison_matrix", "kind": "object"}]},
    {"id": "认知:M13", "kind": "method", "cost": 1,
     "inputs": [{"token": "comparison_matrix", "kind": "object"}],
     "outputs": [{"token": "claims", "kind": "array"}]},
    {"id": "认知:M21", "kind": "method", "cost": 1,
     "inputs": [{"token": "claims", "kind": "array"}],
     "outputs": [{"token": "cluster_set", "kind": "object"}]},
    {"id": "认知:M22", "kind": "method", "cost": 2,
     "inputs": [{"token": "cluster_set", "kind": "object"}],
     "outputs": [{"token": "abstraction_set", "kind": "object"}]},
    {"id": "认知:M23", "kind": "method", "cost": 2,
     "inputs": [{"token": "abstraction_set", "kind": "object"}],
     "outputs": [{"token": "knowledge_system", "kind": "object"}]}
  ],
  "edges": [
    {"from": "认知:M01", "output": "拆解树", "to": "认知:A01", "input": "拆解树",
     "kind": "object", "fail_closed": true},
    {"from": "认知:A01", "output": "claims", "to": "认知:M02", "input": "claims",
     "kind": "array", "fail_closed": true},
    {"from": "认知:M02", "output": "causal_map", "to": "认知:M03", "input": "causal_map",
     "kind": "object", "fail_closed": true},
    {"from": "认知:A01", "output": "claims", "to": "认知:M03", "input": "claims",
     "kind": "array", "fail_closed": true},
    {"from": "认知:M11", "output": "comparison_frame", "to": "认知:M12",
     "input": "comparison_frame", "kind": "object", "fail_closed": true},
    {"from": "认知:M12", "output": "comparison_matrix", "to": "认知:M13",
     "input": "comparison_matrix", "kind": "object", "fail_closed": true},
    {"from": "认知:M13", "output": "claims", "to": "认知:M21", "input": "claims",
     "kind": "array", "fail_closed": true},
    {"from": "认知:A01", "output": "claims", "to": "认知:M21", "input": "claims",
     "kind": "array", "fail_closed": true},
    {"from": "认知:M21", "output": "cluster_set", "to": "认知:M22",
     "input": "cluster_set", "kind": "object", "fail_closed": true},
    {"from": "认知:M22", "output": "abstraction_set", "to": "认知:M23",
     "input": "abstraction_set", "kind": "object", "fail_closed": true}
  ],
  "budget_envelope": 16,
  "conformance": "L2"
}
